prospect_id,prospect_name,company_name,company_size,industry,email_address,title,engagement_score,engagement_signals,tier,status,primary_objection,mvbp_ready,recommended_cta,follow_up_action,days_to_deploy
P001,Name Withheld,Mid-Market Digital Agency,18,Digital Marketing,redacted_email_1@agency.com,Marketing Director,6,"Opened, Clicked Dashboard, Replied",Tier 1 - Hot,Ready for Deployment,None,Yes,"Start Free 30-Day Trial + Schedule Setup Call","Deploy MVBP trial link same day; schedule 30-min white-glove setup call on April 22-23; connect to GA4 or Google Ads",1-2
P002,Name Withheld,Full-Service Creative Agency,35,Digital Marketing,redacted_email_2@agency.com,Operations Manager,6,"Opened, Clicked Demo Link, Replied",Tier 1 - Hot,Ready for Deployment,Integration Roadmap (Salesforce),Yes,"Start Free Trial + Discuss Salesforce Roadmap","Deploy MVBP trial; prepare Salesforce integration roadmap summary; offer early-access to Salesforce connector when available in Q2",1-2
P003,Name Withheld,Independent Agency,12,Digital Marketing,redacted_email_3@agency.com,CMO/Owner,5,"Opened, Replied with Objection","Tier 1 - Hot (with condition)",Ready with Objection Handling,Implementation Complexity (No IT Resources),Yes - if objection addressed,"Start Free Trial + Emphasize No-IT-Required Setup","Deploy MVBP trial; emphasize ""45-minute setup, no IT required""; include managed onboarding offer; schedule call to walk through process",1-3
P004,Name Withheld,Boutique SEO Agency,22,Digital Marketing,redacted_email_4@agency.com,Marketing Manager,4,"Opened, Clicked Dashboard Demo",Tier 2 - Warm,Nurture Sequence,None - Low Urgency,Yes,"View Case Study + Try 30-Day Free Trial","Send 3-email nurture sequence (Days 1, 3, 7); MVBP offer in email 2; target nurture completion by April 28",3-7
P005,Name Withheld,Content Marketing Firm,28,Digital Marketing,redacted_email_5@agency.com,Content Strategy Lead,4,"Opened, Clicked ROI Calculator",Tier 2 - Warm,Nurture Sequence,Likely Cost/ROI Concern,Yes,"Explore ROI Calculator + Schedule Brief Call","Send ROI-focused nurture sequence; emphasize $31,200/year value; offer 15-min ROI discussion with product team",3-7
P006,Name Withheld,Performance Marketing Agency,16,Digital Marketing,redacted_email_6@agency.com,Operations Director,4,"Opened, Clicked Schedule Demo Link",Tier 2 - Warm,Nurture Sequence,None - Low Urgency,Yes,"Schedule 15-Minute Demo Call","Send 3-email nurture sequence; lead email 2 with ""popular demo time slots""; include calendar link for self-booking",3-7
P007,Name Withheld,Multi-Channel Agency,42,Digital Marketing,redacted_email_7@agency.com,Associate Account Manager,3,"Opened, No Clicks",Tier 2 - Warm,Nurture Sequence,Low Engagement Signal (Opened but inactive),Yes,"Explore Time-Savings Benefits + Free Trial","Send nurture sequence focused on specific time-saving scenarios; reference similar team size; minimal friction CTA",7-14
P008,Name Withheld,In-House Marketing Team (Agency Services),19,Digital Marketing,redacted_email_8@agency.com,Marketing Operations Manager,3,"Opened, No Clicks",Tier 2 - Warm,Nurture Sequence,Low Engagement Signal (Opened but inactive),Yes,"See How Agencies Cut Reporting Time + Free Trial","Send nurture sequence focused on internal agency workflow; emphasize dashboard sharing for stakeholder reviews",7-14
